{
  "version": 1,
  "type": "agentpass.browser-onboarding.trust-installation-ack",
  "organization_id": "22222222-2222-4222-8222-222222222222",
  "device_id": "33333333-3333-4333-8333-333333333333",
  "enrollment_id": "11111111-1111-4111-8111-111111111111",
  "device_key_epoch": 3,
  "control_format_epoch": 2,
  "control_sequence": 7,
  "control_statement_hash": "aaaaaaaaaaaaaaaaaaaaaaaaaaaaaaaaaaaaaaaaaaaaaaaaaaaaaaaaaaaaaaaa",
  "trust_fingerprint": "SHA256:BBBBBBBBBBBBBBBBBBBBBBBBBBBBBBBBBBBBBBBBBBB",
  "installed_at": "2099-01-02T03:04:05.000Z",
  "result": "installed"
}
